Código,código subsector,Título,Descripción,Incluye,Excluye
3259,325,Fabricación de otros productos químicos,Unidades económicas dedicadas principalmente a la fabricación de tintas para impresión, explosivos, y otros productos químicos.,Incluye también: u.e.d.p. a la remanufactura de cartuchos de tóner.,Excluye: u.e.d.p. a la elaboración de esencias de sabor para bebidas (3119, Otras industrias alimentarias); a la fabricación de resinas sintéticas (3252, Fabricación de resinas y hules sintéticos, y fibras químicas); de hojas y películas de plástico no sensibilizadas (3261, Fabricación de productos de plástico); de velas y veladoras (3399, Otras industrias manufactureras), y a la recarga de cartuchos de tóner (8112, Reparación y mantenimiento de equipo electrónico y de equipo de precisión).
3261,326,Fabricación de productos de plástico,Unidades económicas dedicadas principalmente a la fabricación de bolsas y películas de plástico flexible para embalaje; tubería, conexiones y tubos para embalaje; laminados de plástico rígido; espumas y productos de poliestireno; espumas y productos de uretano; botellas, y otros productos de plástico.,Incluye también: u.e.d.p. a la fabricación de hojas y películas de plástico no sensibilizadas; de domos; de espumas para aislamiento térmico y acústico; de preformas de botellas; de platos, vasos y cucharas desechables de plástico; de tanques y tinacos de plástico con o sin reforzamiento; de puertas y ventanas de plástico; al recubrimiento de productos de plástico con diversos materiales, y a la fabricación de mallas de plástico de uso industrial y agrícola, como malla sombra, malla para invernadero y para mosquiteros.,Excluye: u.e.d.p. a la fabricación de telas recubiertas con plástico y hule (3133, Acabado de productos textiles y fabricación de telas recubiertas); de calzado de plástico (3162, Fabricación de calzado); de bolsas de papel, y papel recubierto y tratado (3222, Fabricación de productos de cartón y papel); de papel, hojas y películas sensibilizados (3259, Fabricación de otros productos químicos); de mangueras de hule y de plástico; de artículos inflables de hule para alberca (3262, Fabricación de productos de hule); de casetas de plástico reforzado para vehículos de motor (3362, Fabricación de carrocerías y remolques); a la construcción y reconstrucción de barcos, yates, embarcaciones recreativas y deportivas (3366, Fabricación de embarcaciones); a la fabricación de muebles de plástico (3371, Fabricación de muebles, excepto de oficina y estantería); de colchones de espuma de uretano y colchones de agua (3379, Fabricación de colchones, persianas y cortineros); de artículos deportivos de plástico; de juguetes de plástico, y de ganchos para tejer (3399, Otras industrias manufactureras).
3262,326,Fabricación de productos de hule,Unidades económicas dedicadas principalmente a la fabricación y revitalización de llantas; a la fabricación de bandas y mangueras de hule y de plástico, y de otros productos de hule.,,Excluye: u.e.d.p. a la fabricación de telas recubiertas con plástico y hule (3133, Acabado de productos textiles y fabricación de telas recubiertas); de calzado de hule (3162, Fabricación de calzado); de tubería, perfiles y conexiones de plástico rígido, y tubos para embalaje; de artículos inflables de plástico para alberca (3261, Fabricación de productos de plástico); de colchones de agua (3379, Fabricación de colchones, persianas y cortineros); de artículos deportivos y juguetes de plástico y hule (3399, Otras industrias manufactureras), y a la reparación menor de llantas y cámaras de automóviles y camiones (8111, Reparación y mantenimiento de automóviles y camiones).
3271,327,Fabricación de productos a base de arcillas y minerales refractarios,Unidades económicas dedicadas principalmente a la fabricación de artículos de alfarería, porcelana, loza, muebles y accesorios de baño, y de productos para la construcción a base de arcillas refractarias o no refractarias y de productos refractarios arcillosos y no arcillosos.,Incluye también: u.e.d.p. a la obtención de arcilla integrada con la fabricación de productos terminados, y a la fabricación de cemento y mortero refractarios.,Excluye: u.e.d.p. a la fabricación de adoquines (3273, Fabricación de cemento y productos de concreto); de muebles de baño de mármol, granito y de otras piedras de cantera (3279, Fabricación de otros productos a base de minerales no metálicos), y de muebles modulares de baño (3371, Fabricación de muebles, excepto de oficina y estantería).
3272,327,Fabricación de vidrio y productos de vidrio,Véase la descripción de la categoría 32721.,,
3273,327,Fabricación de cemento y productos de concreto,Unidades económicas dedicadas principalmente a la fabricación de cemento, concreto, tubos, bloques y otros productos de cemento y concreto.,Incluye también: u.e.d.p. a la fabricación de productos preesforzados de concreto integrada con la instalación en el lugar de la construcción.,Excluye: u.e.d.p. al montaje de estructuras de concreto prefabricadas (2381, Cimentaciones, montaje de estructuras prefabricadas y trabajos en exteriores); a la fabricación de ladrillos no refractarios, y a la fabricación de cemento y mortero refractarios (3271, Fabricación de productos a base de arcillas y minerales refractarios).
3274,327,Fabricación de cal, yeso y productos de yeso,Unidades económicas dedicadas principalmente a la fabricación de cal, yeso y productos de yeso.,Incluye también: u.e.d.p. a la producción de dolomita calcinada.,Excluye: u.e.d.p. a la minería de piedra de cal (2123, Minería de minerales no metálicos).
3279,327,Fabricación de otros productos a base de minerales no metálicos,Unidades económicas dedicadas principalmente a la fabricación de productos de fricción o abrasivos, y de otros productos a base de minerales no metálicos.,,Excluye: u.e.d.p. a la minería de cantera, mármol, granito, ónix y obsidiana (2123, Minería de minerales no metálicos); a la fabricación de pulidores para metal (3256, Fabricación de jabones, limpiadores y preparaciones de tocador); de muebles de cerámica de baño (3271, Fabricación de productos a base de arcillas y minerales refractarios); de fibras metálicas (3329, Fabricación de otros productos metálicos); de muebles modulares de baño (3371, Fabricación de muebles, excepto de oficina y estantería), y de uniformes de asbesto (3391, Fabricación de equipo no electrónico y material desechable de uso médico, dental y para laboratorio, y artículos oftálmicos).
3311,331,Industria básica del hierro y del acero,Véase la descripción de la categoría 33111.,,
3312,331,Fabricación de productos de hierro y acero,Unidades económicas dedicadas principalmente a la fabricación, a partir de hierro y acero comprados, de tubos, postes, láminas recubiertas y sin recubrir, alambrón, varillas y otros productos de laminación secundaria de hierro y acero.,,Excluye: u.e.d.p. a la fundición primaria integrada con la fabricación de tubos y postes de hierro y acero realizada en complejos siderúrgicos (3311, Industria básica del hierro y del acero).
3313,331,Industria básica del aluminio,Véase la descripción de la categoría 331310.,,
3314,331,Industrias de metales no ferrosos, excepto aluminio,Unidades económicas dedicadas principalmente a la fundición, afinación y refinación de cobre, metales preciosos y otros metales no ferrosos, y a la producción de sus aleaciones, y a la laminación secundaria de cobre y otros materiales no ferrosos.,Incluye también: u.e.d.p. a la recuperación de cobre, metales preciosos y otros metales no ferrosos y sus aleaciones para su laminación secundaria, cuando se realiza fuera de la unidad minera.,Excluye: u.e.d.p. la explotación de cobre por medio de la extracción por solventes y deposición electrolítica (2122, Minería de minerales metálicos); al enriquecimiento de minerales radiactivos (3251, Fabricación de productos químicos básicos); a la producción de aleaciones y formas primarias de aluminio; a la fabricación de productos derivados de la laminación secundaria de aluminio (3313, Industria básica del aluminio), y al moldeo por fundición de todo tipo de piezas a partir de metales no ferrosos comprados (3315, Moldeo por fundición de piezas metálicas).
3315,331,Moldeo por fundición de piezas metálicas,Unidades económicas dedicadas principalmente al moldeo por fundición de todo tipo de piezas a partir de hierro, acero y metales no ferrosos comprados.,,
3321,332,Fabricación de productos metálicos forjados y troquelados,Véase la descripción de la categoría 332110.,,
3322,332,Fabricación de herramientas de mano sin motor y utensilios de cocina metálicos,Véase la descripción de la categoría 33221.,,
3323,332,Fabricación de estructuras metálicas y productos de herrería,Unidades económicas dedicadas principalmente a la fabricación de partes y estructuras metálicas de hierro y acero para la construcción, y de productos de herrería.,Incluye también: u.e.d.p. a la fabricación de estructuras metálicas combinada con la instalación en el lugar de la construcción.,Excluye: u.e.d.p. al montaje de estructuras de acero prefabricadas, y a la instalación o realización de trabajos de herrería en el lugar de la construcción (2381, Cimentaciones, montaje de estructuras prefabricadas y trabajos en exteriores).
3324,332,Fabricación de calderas, tanques y envases metálicos,Unidades económicas dedicadas principalmente a la fabricación de calderas industriales, tanques, depósitos y envases metálicos de calibre grueso y ligero.,,Excluye: u.e.d.p. a la fabricación de calentadores industriales de agua (3333, Fabricación de maquinaria y equipo para el comercio y los servicios); de calderas de calefacción central (3334, Fabricación de equipo de aire acondicionado, calefacción, y de refrigeración industrial y comercial), y de calentadores de agua de uso doméstico (3352, Fabricación de aparatos eléctricos de uso doméstico).
3325,332,Fabricación de herrajes y cerraduras,Véase la descripción de la categoría 332510.,,
3326,332,Fabricación de alambre, productos de alambre y resortes,Véase la descripción de la categoría 332610.,,
3327,332,Maquinado de piezas y fabricación de tornillos,Unidades económicas dedicadas principalmente al maquinado hecho sobre pedido de piezas metálicas nuevas y usadas para maquinaria y equipo en general, y a la fabricación de tornillos, tuercas, remaches y similares.,Incluye también: unidades económicas que combinan el maquinado hecho sobre pedido de piezas nuevas y usadas de metal, plástico, madera y de otros materiales, y a la impresión sobre pedido de productos en tercera dimensión (impresión 3D).,Excluye: u.e.d.p. a la fabricación de clavos (3326, Fabricación de alambre, productos de alambre y resortes); a la reconstrucción en serie de partes de motores de automóviles y camiones (3363, Fabricación de partes para vehículos automotores), y a la rectificación de partes de motor de automóviles y camiones a petición del cliente (8111, Reparación y mantenimiento de automóviles y camiones).
3328,332,Recubrimientos y terminados metálicos,Véase la descripción de la categoría 332810.,,
3329,332,Fabricación de otros productos metálicos,Unidades económicas dedicadas principalmente a la fabricación de válvulas metálicas, baleros, rodamientos, y otros productos metálicos.,,Excluye: u.e.d.p. a la fabricación de mecanismos para cerraduras de cajas fuertes (3325, Fabricación de herrajes y cerraduras).
3331,333,Fabricación de maquinaria y equipo agropecuario, para la construcción y para la industria extractiva,Unidades económicas dedicadas principalmente a la fabricación de maquinaria y equipo para las actividades agropecuarias, la construcción y la industria extractiva.,Incluye también: u.e.d.p. a la fabricación de equipo con motor para jardinería, y de maquinaria y equipo pesado para la silvicultura.,Excluye: u.e.d.p. a la fabricación de herramientas de mano metálicas sin motor (3322, Fabricación de herramientas de mano sin motor y utensilios de cocina metálicos); de herramientas de mano con motor para las actividades agropecuarias (3339, Fabricación de otra maquinaria y equipo para la industria en general), y de camiones revolvedores de concreto (3361, Fabricación de automóviles y camiones).
3332,333,Fabricación de maquinaria y equipo para las industrias manufactureras, excepto la metalmecánica,Véase la descripción de la categoría 33324.,,
3333,333,Fabricación de maquinaria y equipo para el comercio y los servicios,Véase la descripción de la categoría 33331.,,
3334,333,Fabricación de equipo de aire acondicionado, calefacción, y de refrigeración industrial y comercial,Véase la descripción de la categoría 33341.,,
3335,333,Fabricación de maquinaria y equipo para la industria metalmecánica,Véase la descripción de la categoría 333510.,,
3336,333,Fabricación de motores de combustión interna, turbinas y transmisiones,Véase la descripción de la categoría 333610.,,
3339,333,Fabricación de otra maquinaria y equipo para la industria en general,Unidades económicas dedicadas principalmente a la fabricación de maquinaria y equipo para la industria en general, como bombas y sistemas de bombeo; maquinaria y equipo para levantar y trasladar; equipo para soldar y soldaduras; maquinaria y equipo para envasar y empacar; aparatos e instrumentos para pesar, y otra maquinaria y equipo para la industria en general.,Incluye también: u.e.d.p. a la fabricación de equipo para la compresión de aire o gas, y de equipo de aspersión y espolvoreo de uso industrial.,Excluye: u.e.d.p. a la fabricación de carretillas de mano, gatos mecánicos y cautines de mano (3322, Fabricación de herramientas de mano sin motor y utensilios de cocina metálicos); de tractores agrícolas y tractores de oruga (3331, Fabricación de maquinaria y equipo agropecuario, para la construcción y para la industria extractiva); de compresoras para refrigeración y aire acondicionado, y sopladores industriales (3334, Fabricación de equipo de aire acondicionado, calefacción, y de refrigeración industrial y comercial), y de electrodos para uso térmico y electrolítico (3359, Fabricación de otros equipos y accesorios eléctricos).
3341,334,Fabricación de computadoras y equipo periférico,Véase la descripción de la categoría 334110.,,
3342,334,Fabricación de equipo de comunicación,Unidades económicas dedicadas principalmente a la fabricación de equipo de comunicación, como equipo telefónico; equipo de transmisión y recepción de señales de radio, televisión abierta, por cable y satelital; de equipo de comunicación inalámbrico, y otros equipos de comunicación.,Incluye también: u.e.d.p. a la fabricación de equipo telegráfico, de teléfonos celulares, de equipo para circuito cerrado de audio y video, de cámaras de televisión, equipo para estudios de grabación de audio y video, y de equipo de control de alumbrado público.,Excluye: u.e.d.p. a la fabricación de equipo de audio y video (3343, Fabricación de equipo de audio y de video); de módem para computadora, fax y teléfono (3344, Fabricación de componentes electrónicos); de instrumentos de navegación aeronáutica y náutica (3345, Fabricación de instrumentos de medición, control, navegación, y equipo médico electrónico), y de letreros informativos y señalamientos fijos para tráfico (3399, Otras industrias manufactureras).
3343,334,Fabricación de equipo de audio y de video,Véase la descripción de la categoría 334310.,,
3344,334,Fabricación de componentes electrónicos,Véase la descripción de la categoría 334410.,,
3345,334,Fabricación de instrumentos de medición, control, navegación, y equipo médico electrónico,Véase la descripción de la categoría 33451.,,
3346,334,Fabricación y reproducción de medios magnéticos y ópticos,Véase la descripción de la categoría 334610.,,
3351,335,Fabricación de accesorios de iluminación,Unidades económicas dedicadas principalmente a la fabricación de focos y lámparas ornamentales.,Incluye también: u.e.d.p. a la fabricación de series de luces de Navidad, lámparas contra insectos y linternas.,
3352,335,Fabricación de aparatos eléctricos de uso doméstico,Unidades económicas dedicadas principalmente a la fabricación de enseres electrodomésticos menores y aparatos de línea blanca.,Incluye también: u.e.d.p. a la fabricación de almohadas y cobertores eléctricos, y calentadores de agua de uso doméstico.,Excluye: u.e.d.p. a la fabricación de máquinas de coser de uso doméstico (3332, Fabricación de maquinaria y equipo para las industrias manufactureras, excepto la metalmecánica).
3353,335,Fabricación de equipo de generación y distribución de energía eléctrica,Véase la descripción de la categoría 33531.,,
3359,335,Fabricación de otros equipos y accesorios eléctricos,Unidades económicas dedicadas principalmente a la fabricación de baterías, acumuladores y pilas; cables de conducción eléctrica; enchufes, contactos, fusibles y otros accesorios para instalaciones eléctricas, y de otros productos eléctricos.,Incluye también: u.e.d.p. a la fabricación de cables para comunicaciones.,Excluye: u.e.d.p. a la fabricación de piezas de cerámica para uso eléctrico (3271, Fabricación de productos a base de arcillas y minerales refractarios); de fibra de vidrio; productos de vidrio para la industria eléctrica (3272, Fabricación de vidrio y productos de vidrio); de alambre sin aislar (3326, Fabricación de alambre, productos de alambre y resortes); de electrodos para soldadura autógena (3339, Fabricación de otra maquinaria y equipo para la industria en general); de conductores, condensadores y capacitores electrónicos (3344, Fabricación de componentes electrónicos); de fusibles e interruptores para la distribución de energía eléctrica (3353, Fabricación de equipo de generación y distribución de energía eléctrica), y de equipo eléctrico y sus partes e interruptores eléctricos y electrónicos para vehículos automotores (3363, Fabricación de partes para vehículos automotores).
3361,336,Fabricación de automóviles y camiones,Unidades económicas dedicadas principalmente a la fabricación de automóviles, camionetas, autobuses, camiones y tractocamiones.,Incluye también: u.e.d.p. a la fabricación de automóviles y camionetas eléctricos y blindados, y de vehículos de reparto y de uso industrial accionados por motores eléctricos o híbridos.,Excluye: u.e.d.p. a la fabricación de remolques, semirremolques y carrocerías ensamblados sobre chasises comprados (3362, Fabricación de carrocerías y remolques); de autos de carreras (3369, Fabricación de otro equipo de transporte), y a los servicios de blindaje a petición del cliente (8111, Reparación y mantenimiento de automóviles y camiones).
3362,336,Fabricación de carrocerías y remolques,Véase la descripción de la categoría 336210.,,
3363,336,Fabricación de partes para vehículos automotores,Unidades económicas dedicadas principalmente a la fabricación de partes para vehículos automotores (automóviles, camionetas, camiones, trenes, barcos y aeronaves), como motores de gasolina, híbridos y de combustibles alternativos para vehículos automotrices (automóviles, camionetas y camiones); equipo eléctrico y electrónico para vehículos automotores; sistemas de dirección, suspensión y frenos para vehículos automotrices; sistemas de transmisión, asientos y accesorios interiores para vehículos automotores; piezas metálicas troqueladas y otras partes para vehículos automotrices.,,Excluye: u.e.d.p. a la fabricación de autopartes de plástico (3261, Fabricación de productos de plástico); de placas troqueladas para automóvil; de partes para vehículos automotrices mediante pulvimetalurgia (3321, Fabricación de productos metálicos forjados y troquelados); de motores diésel (3336, Fabricación de motores de combustión interna, turbinas y transmisiones); de alarmas automotrices (3342, Fabricación de equipo de comunicación); de motores eléctricos (3353, Fabricación de equipo de generación y distribución de energía eléctrica); de baterías y acumuladores (3359, Fabricación de otros equipos y accesorios eléctricos); a la rectificación de partes de motor de automóviles y camiones a petición del cliente, y al tapizado de asientos de automóviles y camiones (8111, Reparación y mantenimiento de automóviles y camiones).
3364,336,Fabricación de equipo aeroespacial,Véase la descripción de la categoría 336410.,,
3365,336,Fabricación de equipo ferroviario,Véase la descripción de la categoría 336510.,,
3366,336,Fabricación de embarcaciones,Véase la descripción de la categoría 336610.,,
3369,336,Fabricación de otro equipo de transporte,Véase la descripción de la categoría 33699.,,
3371,337,Fabricación de muebles, excepto de oficina y estantería,Unidades económicas dedicadas principalmente a la fabricación de muebles, excepto de oficina y estantería.,Incluye también: u.e.d.p. a la fabricación de restiradores y pizarrones.,Excluye: u.e.d.p. a la instalación de cocinas integrales y muebles de baño (2383, Trabajos de acabados en edificaciones); a la fabricación de muebles de baño de cerámica (3271, Fabricación de productos a base de arcillas y minerales refractarios); de muebles de baño de mármol, granito y otras piedras de cantera (3279, Fabricación de otros productos a base de minerales no metálicos); de muebles de oficina y estantería (3372, Fabricación de muebles de oficina y estantería); restauradores de muebles antiguos (7115, Artistas, escritores y técnicos independientes), y a la reparación de muebles para el hogar (8114, Reparación y mantenimiento de artículos para el hogar y personales).
3372,337,Fabricación de muebles de oficina y estantería,Véase la descripción de la categoría 337210.,,
3379,337,Fabricación de colchones, persianas y cortineros,Unidades económicas dedicadas principalmente a la fabricación de colchones, box spring, persianas y cortineros.,Incluye también: u.e.d.p. a la fabricación de colchones de espuma de uretano y colchones de agua.,Excluye: u.e.d.p. a la confección de cortinas y colchonetas (3141, Confección de alfombras, blancos y similares); a la fabricación de artículos inflables de plástico para alberca (3261, Fabricación de productos de plástico); de artículos inflables de hule para alberca (3262, Fabricación de productos de hule), y de resortes para camas y colchones (3326, Fabricación de alambre, productos de alambre y resortes).
3391,339,Fabricación de equipo no electrónico y material desechable de uso médico, dental y para laboratorio, y artículos oftálmicos,Véase la descripción de la categoría 33911.,,
3399,339,Otras industrias manufactureras,Unidades económicas dedicadas principalmente a la metalistería y joyería; a la fabricación de artículos deportivos; juguetes; artículos y accesorios para escritura, pintura, dibujo y actividades de oficina; de anuncios y señalamientos, y otras manufacturas no clasificadas en otra parte.,Incluye también: u.e.d.p. a la fabricación de cuchillería de mesa de metales preciosos; de cajas musicales; de ganchos para tejer, alfileres, broches de presión, ojillos, pasadores, hebillas, y de cepillos dentales.,Excluye: u.e.d.p. a la fabricación de tiendas de campaña; de redes para deportes (3149, Fabricación de otros productos textiles, excepto prendas de vestir); de ropa deportiva (315, Fabricación de prendas de vestir); de calzado deportivo (3162, Fabricación de calzado); de cintas engomadas de todo tipo (3222, Fabricación de productos de cartón y papel); de tinta para escritura y dibujo (3259, Fabricación de otros productos químicos); de balsas y botes de plástico inflables (3261, Fabricación de productos de plástico); de balsas y botes de hule inflables (3262, Fabricación de productos de hule); a la fabricación de piedras sintéticas para joyería (3279, Fabricación de otros productos a base de minerales no metálicos); al chapeado de piezas metálicas con metales preciosos y al grabado de metales (3328, Recubrimientos y terminados metálicos); a la fabricación de juntas expansivas metálicas de uso industrial (3329, Fabricación de otros productos metálicos); de equipo de señalamiento y control de tráfico aéreo, ferroviario, náutico, terrestre y peatonal (3342, Fabricación de equipo de comunicación); a la reproducción de juegos de video (3346, Fabricación y reproducción de medios magnéticos y ópticos); a la fabricación de bicicletas y triciclos (3369, Fabricación de otro equipo de transporte); de cascos de futbol americano y para corredores de autos (3391, Fabricación de equipo no electrónico y material desechable de uso médico, dental y para laboratorio, y artículos oftálmicos); al diseño de anuncios (con la subcontratación de otra unidad económica para que los fabrique); a proporcionar servicios de rotulación (5418, Servicios de publicidad y actividades relacionadas), y a la fabricación de artesanías de un solo material, clasificadas de acuerdo con el material del que están elaboradas.
