Código,código subsector,Título,Descripción,Incluye,Excluye
4854,485,Transporte escolar y de personal,Véase la descripción de la categoría 485410.,,
4855,485,Alquiler de autobuses con chofer,Véase la descripción de la categoría 485510.,,
4859,485,Otro transporte terrestre de pasajeros,Véase la descripción de la categoría 485990.,,
4861,486,Transporte de petróleo crudo por ductos,Véase la descripción de la categoría 486110.,,
4862,486,Transporte de gas natural por ductos,Véase la descripción de la categoría 486210.,,
4869,486,Transporte por ductos de otros productos,Unidades económicas dedicadas principalmente al transporte por ductos de productos refinados del petróleo como petróleo refinado, condensados del gas natural, gasolina, y de carbón y otros productos diversos no clasificados en otra parte.,,Excluye: u.e.d.p. a la obtención de gas butano natural, etano natural, e hidrocarburos líquidos en campos petroleros y de gas natural (2111, Extracción de petróleo y gas); al suministro de gas natural por ductos al consumidor final (2212, Suministro de gas natural por ductos al consumidor final); al transporte de petróleo crudo por ductos (4861, Transporte de petróleo crudo por ductos), y de gas natural por ductos (4862, Transporte de gas natural por ductos).
4871,487,Transporte turístico por tierra,Véase la descripción de la categoría 487110.,,
4872,487,Transporte turístico por agua,Véase la descripción de la categoría 487210.,,
4879,487,Otro transporte turístico,Véase la descripción de la categoría 487990.,,
4881,488,Servicios relacionados con el transporte aéreo,Unidades económicas dedicadas principalmente a proporcionar servicios relacionados con el transporte aéreo, como servicios a la navegación aérea, administración de aeropuertos y helipuertos, reparación y mantenimiento de aeronaves, y otros servicios relacionados con el transporte aéreo.,Incluye también: u.e.d.p. a los servicios de carga y descarga de mercancías y equipaje.,Excluye: u.e.d.p. a la limpieza interior de aviones (5617, Servicios de limpieza).
4882,488,Servicios relacionados con el transporte por ferrocarril,Véase la descripción de la categoría 488210.,,
4883,488,Servicios relacionados con el transporte por agua,Unidades económicas dedicadas principalmente a proporcionar servicios relacionados con el transporte por agua, como administración y operación de puertos y muelles; carga y descarga de mercancías y equipaje en las embarcaciones; ayuda para la navegación por agua; reparación, mantenimiento y conversión de barcos y yates que requieren tripulación, limpieza exterior de embarcaciones, inspección y pesaje de carga para el transporte por agua, y otros servicios relacionados con el transporte por agua no clasificados en otra parte.,Incluye también: u.e.d.p. a la operación de faros.,Excluye: u.e.d.p. a la reparación, mantenimiento, conversión y modificación de barcos y yates cuando es llevada a cabo en la misma unidad económica que los fabrica (3366, Fabricación de embarcaciones); a proporcionar servicios de tramitación para la importación y exportación de mercancías, y servicios de intermediación para el transporte de carga de las agencias consignatarias, navieras o consolidadoras de carga (4885, Servicios de intermediación para el transporte de carga); a la limpieza interior de barcos (5617, Servicios de limpieza); al almacenamiento y amarre de embarcaciones turísticas (7139, Otros servicios recreativos), y a la reparación, mantenimiento y modificación de embarcaciones recreativas, excepto yates que requieren tripulación (8114, Reparación y mantenimiento de artículos para el hogar y personales).
4884,488,Servicios relacionados con el transporte por carretera,Unidades económicas dedicadas principalmente al remolque de vehículos automotores; a la administración de centrales camioneras; a la administración de carreteras y puentes, y servicios auxiliares para los usuarios de las carreteras; a proporcionar servicios de pesaje de vehículos de autotransporte de carga, y otros servicios relacionados con el transporte por carretera.,,Excluye: u.e.d.p. al transporte colectivo urbano, suburbano y foráneo de pasajeros en autobuses (485, Transporte terrestre de pasajeros, excepto por ferrocarril); al remolque y salvamento de embarcaciones marítimas (4883, Servicios relacionados con el transporte por agua); a proporcionar una variedad de servicios administrativos para la administración diaria de negocios (5611, Servicios de administración de negocios), y al servicio de estacionamiento de vehículos automotores (8124, Estacionamientos y pensiones para vehículos automotores).
4885,488,Servicios de intermediación para el transporte de carga,Véase la descripción de la categoría 48851.,,
4889,488,Otros servicios relacionados con el transporte,Véase la descripción de la categoría 488990.,,
4911,491,Servicios postales,Véase la descripción de la categoría 491110.,,
4921,492,Servicios de mensajería y paquetería foránea,Véase la descripción de la categoría 492110.,,
4922,492,Servicios de mensajería y paquetería local,Véase la descripción de la categoría 492210.,,
4931,493,Servicios de almacenamiento,Unidades económicas dedicadas principalmente al almacenamiento de productos, tanto en instalaciones especializadas como no especializadas. Estas unidades económicas pueden realizar actividades de control y manejo de inventarios, ensamblado, empacado, marcado de precios, etiquetado de mercancías y arreglos para distribución o recolección de las mercancías.,,Excluye: u.e.d.p. al alquiler sin intermediación de bodegas de autoalmacenaje (5311, Alquiler sin intermediación de bienes raíces).
5111,511,Edición de periódicos, revistas, libros y similares, y edición de estas publicaciones integrada con la impresión,Unidades económicas dedicadas principalmente a la edición de periódicos, revistas, boletines y otras publicaciones periódicas, libros, enciclopedias y atlas, directorios, listas de correo, catálogos, folletos y otros materiales, y a la edición de estas publicaciones integrada con la impresión en papel o con la grabación en formato electrónico, por ejemplo en discos compactos (CD). Las unidades económicas dedicadas a la edición se caracterizan por la creatividad intelectual que se requiere para el desarrollo de sus actividades, publican copias de trabajos de los cuales poseen los derechos de autor, ya sea porque realizaron una creación propia, o bien, porque adquirieron los derechos de reproducción a través de licenciamientos; pueden contar con la infraestructura necesaria para realizar las actividades de distribución de sus productos o realizan acuerdos para la distribución de los mismos; asimismo, pueden contratar los servicios de impresión. Los ingresos que obtienen son por venta y licenciamiento de las publicaciones.,Incluye también: u.e.d.p. a la edición de periódicos, revistas, boletines y otras publicaciones periódicas (incluso aquellas que únicamente anuncian bienes o servicios), libros, enciclopedias y atlas, directorios, listas de correo, catálogos, folletos y otros materiales integrada con la impresión en papel o con la grabación en formato electrónico combinada con su difusión a través de internet.,Excluye: u.e.d.p. a la impresión en papel de publicaciones (3231, Impresión e industrias conexas); a la reproducción masiva de publicaciones en discos compactos (CD) y otros medios electrónicos (3346, Fabricación y reproducción de medios magnéticos y ópticos); al desarrollo y edición de software masivo o empacado (5112, Edición de software y edición de software integrada con la reproducción); a la edición de partituras (5122, Industria del sonido); a la recopilación y suministro de material informativo de actualidad para estaciones de radio y televisión, periódicos y revistas; a la edición y difusión de publicaciones exclusivamente a través de internet; a proporcionar servicios de búsqueda de información (5191, Otros servicios de información); a la elaboración de mapas (5413, Servicios de arquitectura, ingeniería y actividades relacionadas); al diseño y ejecución de campañas publicitarias por correo directo combinados con la compilación, mantenimiento, renta y venta de listas de clientes potenciales (5418, Servicios de publicidad y actividades relacionadas), y artistas dedicados exclusivamente a generar dibujos e ilustraciones (5414, Diseño especializado).
5112,511,Edición de software y edición de software integrada con la reproducción,Véase la descripción de la categoría 511210.,,
5121,512,Industria fílmica y del video,Unidades económicas dedicadas principalmente a la prestación de servicios fílmicos y del video, como la producción, distribución y exhibición de películas en formato de cine y de video; la producción de programas para la televisión y otros materiales audiovisuales, y a los servicios de postproducción.,Incluye también: u.e.d.p. a la producción de películas en formato de cine y de video, videoclips, comerciales y otros materiales audiovisuales integrada con su distribución; a la organización de festivales cinematográficos, y a la exhibición de películas combinada con el comercio al por menor de dulces bajo la misma razón social.,Excluye: u.e.d.p. a la reproducción masiva de películas, programas o series de televisión y videoclips en formato digital (3346, Fabricación y reproducción de medios magnéticos y ópticos); a la comercialización de cintas y discos de video digital (DVD) al por mayor y al por menor (4333, Comercio al por mayor de discos, juguetes y artículos deportivos; 4652, Comercio al por menor de artículos para el esparcimiento); al comercio al por menor especializado de dulces (4611, Comercio al por menor de abarrotes y alimentos); a la transmisión de programas de televisión mediante señal abierta (5151, Transmisión de programas de radio y televisión); a la producción de la programación de un canal de televisión, con material propio o adquirido, para su distribución a los sistemas de televisión por suscripción (5152, Producción de programación de canales para sistemas de televisión por cable o satelitales); a los servicios de video bajo demanda, y filmotecas y videotecas (5191, Otros servicios de información); u.e.d.p. al alquiler de videocasetes y discos (5322, Alquiler de artículos para el hogar y personales); a proporcionar servicios de fotografía y videograbación, y de traducción e interpretación (5419, Otros servicios profesionales, científicos y técnicos); a la transcripción simultánea de diálogos para la televisión (5614, Servicios de apoyo secretarial, fotocopiado, cobranza, investigación crediticia y similares); a la organización y promoción de espectáculos artísticos y culturales con o sin instalaciones (7113, Promotores de espectáculos artísticos, culturales, deportivos y similares); a los servicios técnicos de apoyo a la industria fílmica y del video, como actuación, producción ejecutiva y diseño de vestuario teatral por cuenta propia (7115, Artistas, escritores y técnicos independientes), y a proporcionar los servicios de revelado e impresión de fotografías (8129, Servicios de revelado e impresión de fotografías y otros servicios personales).
5122,512,Industria del sonido,Unidades económicas dedicadas principalmente a la producción de material discográfico, como discos compactos (CD) y de video digital (DVD) o casetes musicales; a la producción de este material integrada con su reproducción o con su distribución; a administrar los derechos de autor de obras musicales en beneficio de sus poseedores; a proporcionar las instalaciones y la experiencia técnica para la grabación de discos compactos (CD) y de video digital (DVD) o casetes musicales, y a proporcionar otros servicios de grabación del sonido.,Incluye también: u.e.d.p. a la edición de partituras.,Excluye: u.e.d.p. a la reproducción masiva de discos compactos (CD) y de video digital (DVD) o casetes musicales (3346, Fabricación y reproducción de medios magnéticos y ópticos); a la comercialización de discos compactos (CD) y de video digital (DVD) o casetes musicales al por mayor y al por menor (4333, Comercio al por mayor de discos, juguetes y artículos deportivos; 4652, Comercio al por menor de artículos para el esparcimiento); a la edición de libros de música y a la edición integrada con la impresión de libros de música (5111, Edición de periódicos, revistas, libros y similares, y edición de estas publicaciones integrada con la impresión); a la transmisión de programas de radio mediante señal abierta (5151, Transmisión de programas de radio y televisión), y compositores musicales independientes (7115, Artistas, escritores y técnicos independientes).
5151,515,Transmisión de programas de radio y televisión,Unidades económicas dedicadas principalmente a la transmisión de programas de radio y televisión mediante señal abierta.,Incluye también: u.e.d.p. a los servicios de repetición de programas de radio; de radio por suscripción, redes de radio y radio satelital; a la producción y transmisión de programas realizadas por las estaciones de televisión, y a los servicios de repetición de programas de televisión.,Excluye: u.e.d.p. a la producción de programas y comerciales para la televisión no realizada por las estaciones de televisión; a la distribución de programas para la televisión (5121, Industria fílmica y del video); a proporcionar servicios de audiograbación de programas y comerciales radiofónicos (5122, Industria del sonido); a la producción de la programación de un canal de televisión, con material propio o adquirido, para su distribución a los sistemas de televisión por suscripción (5152, Producción de programación de canales para sistemas de televisión por cable o satelitales); a la prestación de servicios de telecomunicaciones mediante sistemas de televisión restringida alámbrica (5173, Operadores de servicios de telecomunicaciones alámbricas e inalámbricas); a los servicios de telecomunicaciones por satélite (5174, Operadores de servicios de telecomunicaciones vía satélite); a la edición y difusión de programas de radio y de televisión exclusivamente a través de internet, a los servicios de video bajo demanda, y filmotecas y videotecas (5191, Otros servicios de información).
5152,515,Producción de programación de canales para sistemas de televisión por cable o satelitales,Véase la descripción de la categoría 515210.,,
5173,517,Operadores de servicios de telecomunicaciones alámbricas e inalámbricas,Véase la descripción de la categoría 51731.,,
5174,517,Operadores de servicios de telecomunicaciones vía satélite,Véase la descripción de la categoría 517410.,,
5179,517,Otros servicios de telecomunicaciones,Véase la descripción de la categoría 517910.,,
5182,518,Procesamiento electrónico de información, hospedaje y otros servicios relacionados,Véase la descripción de la categoría 518210.,,
5191,519,Otros servicios de información,Unidades económicas dedicadas principalmente a proporcionar otros servicios de información, como recopilación y suministro de material informativo de actualidad para estaciones de radio y televisión, periódicos y revistas; a coleccionar, clasificar, almacenar y preservar documentos para la lectura y la consulta; a editar y difundir contenido exclusivamente a través de internet, así como a difundir programas de radio y de televisión exclusivamente a través de internet; a operar sitios web que usan un motor de búsqueda para generar y mantener extensas bases de datos para internet en un formato de búsqueda fácil y se conocen como portales de búsqueda en la web; a los servicios de información por teléfono mediante mensajes pregrabados, y a los servicios de búsqueda de información.,Incluye también: u.e.d.p. a los servicios de video bajo demanda, y filmotecas, videotecas, y centros de información y de documentación.,Excluye: u.e.d.p. a la comercialización de mercancías al por mayor y al por menor a través de internet (4372, Intermediación de comercio al por mayor exclusivamente a través de internet y otros medios electrónicos; 4691, Comercio al por menor exclusivamente a través de internet, y catálogos impresos, televisión y similares); a la edición de periódicos, revistas, libros, directorios, software y otros materiales; a la edición de estas publicaciones integrada con la impresión en papel o con la grabación en formato electrónico, y a la edición de estas publicaciones integrada con la impresión en papel o con la grabación en formato electrónico combinada con su difusión a través de internet (511, Edición de periódicos, revistas, libros, software y otros materiales, y edición de estas publicaciones integrada con la impresión); a la exhibición de películas; a proporcionar servicios de crestomatía (5121, Industria fílmica y del video); a la transmisión de programas de radio o televisión mediante señal abierta (5151, Transmisión de programas de radio y televisión); a la producción de la programación de un canal de televisión, con material propio o adquirido, para su distribución a los sistemas de televisión por suscripción (5152, Producción de programación de canales para sistemas de televisión por cable o satelitales); a proporcionar servicios de acceso alámbrico e inalámbrico a internet, y a la transmisión de programas de televisión restringida (5173, Operadores de servicios de telecomunicaciones alámbricas e inalámbricas); a proporcionar servicios de microfilmación; servicios de flujo de datos en línea en tiempo real de audio y video (streaming) (5182, Procesamiento electrónico de información, hospedaje y otros servicios relacionados); a la elaboración de mapas (5413, Servicios de arquitectura, ingeniería y actividades relacionadas); a proporcionar acceso a computadoras para usar internet; a los servicios de correo de voz (5614, Servicios de apoyo secretarial, fotocopiado, cobranza, investigación crediticia y similares); servicios de corresponsalía por cuenta propia, y escritores y fotógrafos independientes (7115, Artistas, escritores y técnicos independientes).
5211,521,Banca central,Véase la descripción de la categoría 521110.,,
5221,522,Banca múltiple ,Véase la descripción de la categoría 522110.,,
5222,522,Instituciones financieras de fomento económico ,Unidades económicas sin fines de lucro dedicadas principalmente a la captación y colocación de recursos del público para apoyar el desarrollo de proyectos económicos, y a la administración de fondos y fideicomisos financieros para estimular las actividades sociales y de producción.,,Excluye: instituciones de banca múltiple (5221, Banca múltiple); u.e.d.p. a la administración de fondos para el retiro (5242, Servicios relacionados con los seguros y las fianzas, y administración de fondos para el retiro); Entidades (instrumentos de inversión) que tienen por objeto invertir recursos destinados al largo plazo (retiro) y que podrán ser utilizados cuando el titular (el trabajador) llegue a la edad de jubilación o en casos de invalidez o incapacidad (5251, Sociedades de inversión especializadas en fondos para el retiro), y Entidades (instrumentos de inversión) que tienen por objeto la adquisición y venta de activos objeto de inversión con recursos provenientes de la colocación de las acciones representativas de su capital social en el mercado (5252, Fondos de inversión).
5223,522,Uniones de crédito e instituciones de ahorro ,Unidades económicas dedicadas principalmente a facilitar el uso de crédito a sus socios y a fomentar el ahorro nacional mediante mecanismos alternativos a los tradicionales, consistentes en captar las aportaciones de sus socios para otorgar préstamos a estos mismos, y a la captación de depósitos del público ahorrador para el otorgamiento de créditos y préstamos.,Incluye también: sociedades de ahorro y préstamo.,
5224,522,Otras instituciones de intermediación crediticia y financiera no bursátil ,Unidades económicas dedicadas principalmente al autofinanciamiento, otorgamiento de préstamos prendarios, a la operación y promoción de tarjetas de crédito no bancarias, al financiamiento de bienes duraderos (financiadoras), y sociedades financieras de objeto múltiple.,,Excluye: u.e.d.p. al comercio al por menor de antigüedades y obras de arte (4663, Comercio al por menor de artículos para la decoración de interiores); de artículos usados (4664, Comercio al por menor de artículos usados); al procesamiento de transacciones vinculadas con tarjetas de crédito bancarias (5225, Servicios relacionados con la intermediación crediticia no bursátil); al alquiler de bienes muebles, y al alquiler de bienes muebles en combinación con el arrendamiento financiero (532, Servicios de alquiler de bienes muebles).
5225,522,Servicios relacionados con la intermediación crediticia no bursátil ,Véase la descripción de la categoría 522510.,,
5231,523,Casas de bolsa, casas de cambio y centros cambiarios,Unidades económicas dedicadas principalmente a la intermediación financiera entre el público inversionista y las unidades económicas suscritas en el mercado de valores y el gobierno, mediante la colocación, compra y venta de acciones, instrumentos de deuda y valores, y a las operaciones de compra-venta de divisas.,,Excluye: u.e.d.p. a la administración del mercado de valores (5232, Bolsa de valores), y a proporcionar servicios de asesoría en inversiones en el mercado de valores (5239, Asesoría en inversiones y otros servicios relacionados con la intermediación bursátil).
5232,523,Bolsa de valores,Véase la descripción de la categoría 523210.,,
5239,523,Asesoría en inversiones y otros servicios relacionados con la intermediación bursátil,Unidades económicas dedicadas principalmente a proporcionar servicios de asesoría en inversiones en el mercado de valores, sin efectuar alguna transacción en el mercado accionario, y otros servicios relacionados con la intermediación bursátil.,,Excluye: u.e.d.p. a la administración del mercado de valores (5232, Bolsa de valores); a la consultoría en administración, y en economía (5416, Servicios de consultoría administrativa, científica y técnica), y casas de bolsa (5231, Casas de bolsa, casas de cambio y centros cambiarios).
5241,524,Compañías de seguros y fianzas,Unidades económicas dedicadas principalmente a la emisión de pólizas de seguros, como los seguros de vida, contra accidentes, robo o daños, y a la suscripción de pólizas de fianzas.,Incluye también: unidades económicas (aseguradoras) dedicadas principalmente a la contratación de seguros con riesgos correlacionados (reaseguramiento), y unidades económicas (afianzadoras) dedicadas principalmente a la distribución del riesgo de una fianza entre dos o más afianzadoras (reafianzamiento).,Excluye: u.e.d.p. a la colocación o venta directa al público de contratos o pólizas de seguros o fianzas (5242, Servicios relacionados con los seguros y las fianzas, y administración de fondos para el retiro).
5242,524,Servicios relacionados con los seguros y las fianzas, y administración de fondos para el retiro,Unidades económicas dedicadas principalmente a proporcionar servicios relacionados con los seguros y fianzas, como la colocación o venta directa al público de contratos o pólizas de seguros o fianzas; a la realización de ajustes y gestiones del seguro en caso de siniestro, y a la administración de fondos para el retiro.,,Excluye: u.e.d.p. a la administración de los recursos captados a través de fondos financieros para estimular las actividades sociales y de producción (5222, Instituciones financieras de fomento económico); a la emisión de pólizas de seguros de vida, contra accidentes, robo o daños; al aseguramiento de la vida de los campesinos y de sus propiedades, y afianzadoras (5241, Compañías de seguros y fianzas); Entidades (instrumentos de inversión) que tienen por objeto invertir recursos destinados al largo plazo (retiro) y que podrán ser utilizados cuando el titular (el trabajador) llegue a la edad de jubilación o en casos de invalidez o incapacidad (5251, Sociedades de inversión especializadas en fondos para el retiro), y Entidades (instrumentos de inversión) que tienen por objeto la adquisición y venta de activos objeto de inversión con recursos provenientes de la colocación de las acciones representativas de su capital social en el mercado (5252, Fondos de inversión).
5251,525,Sociedades de inversión especializadas en fondos para el retiro ,Véase la descripción de la categoría 525110.,,
5252,525,Fondos de inversión ,Véase la descripción de la categoría 525210.,,
5311,531,Alquiler sin intermediación de bienes raíces,Véase la descripción de la categoría 53111.,,
5312,531,Inmobiliarias y corredores de bienes raíces,Véase la descripción de la categoría 531210.,,
5313,531,Servicios relacionados con los servicios inmobiliarios,Véase la descripción de la categoría 53131.,,
