Código,código subsector,Título,Descripción,Incluye,Excluye
5321,532,Alquiler de automóviles, camiones y otros transportes terrestres,Unidades económicas dedicadas principalmente al alquiler de automóviles, camiones de carga, autobuses, minibuses y remolques sin chofer.,Incluye también: u.e.d.p. al alquiler de automóviles, camiones de carga, autobuses, minibuses y remolques sin chofer en combinación con el arrendamiento financiero, y al alquiler de casas rodantes no establecidas en un sitio para ser ocupadas como vivienda.,Excluye: u.e.d.p. al alquiler de automóviles, camiones de carga, autobuses y minibuses con chofer (48-49, Transportes, correos y almacenamiento); al arrendamiento financiero de automóviles, camiones de carga, autobuses, minibuses y remolques (5224, Otras instituciones de intermediación crediticia y financiera no bursátil); al alquiler de casas rodantes establecidas en un sitio para ser ocupadas como viviendas (5311, Alquiler sin intermediación de bienes raíces), y al alquiler de equipo de transporte, excepto terrestre (5324, Alquiler de maquinaria y equipo agropecuario, pesquero, industrial, comercial y de servicios).
5322,532,Alquiler de artículos para el hogar y personales,Unidades económicas dedicadas principalmente al alquiler de artículos para el hogar y personales, como aparatos eléctricos y electrónicos; prendas de vestir; mesas, sillas, vajillas y similares, y otros artículos para el hogar y personales no clasificados en otra parte.,Incluye también: u.e.d.p. al alquiler de equipo y vehículos recreativos y deportivos (motocicletas, bicicletas, yates, canoas, botes, planeadores, carros de golf, equipo para bucear y equipo para esquiar).,Excluye: u.e.d.p. al transporte turístico en diversos medios (487, Transporte turístico); al alquiler de barcos para el transporte; equipo de cómputo; mobiliario de oficina; equipo médico para clínicas y hospitales, y equipo de sonido para fiestas (5324, Alquiler de maquinaria y equipo agropecuario, pesquero, industrial, comercial y de servicios); a proporcionar servicios de esquí acuático y paseos en paracaídas (7139, Otros servicios recreativos), y servicios de lavandería en combinación con el alquiler de uniformes, blancos y pañales (8122, Lavanderías y tintorerías).
5323,532,Centros generales de alquiler,Véase la descripción de la categoría 532310.,,
5324,532,Alquiler de maquinaria y equipo agropecuario, pesquero, industrial, comercial y de servicios,Unidades económicas dedicadas principalmente al alquiler de maquinaria y equipo agropecuario, pesquero e industrial sin operador, y maquinaria y equipo comercial y de servicios.,Incluye también: u.e.d.p. al alquiler de maquinaria y equipo agropecuario, pesquero e industrial sin operador, y maquinaria y equipo comercial y de servicios en combinación con el arrendamiento financiero, y de maquinaria y equipo de uso general (válvulas, bombas, extintores, rociadores y calderas).,Excluye: u.e.d.p. al alquiler de maquinaria y equipo de uso agrícola con operador (1151, Servicios relacionados con la agricultura); de maquinaria y equipo de uso pecuario con operador (1152, Servicios relacionados con la cría y explotación de animales); de maquinaria y equipo de uso forestal con operador (1153, Servicios relacionados con el aprovechamiento forestal); de maquinaria y equipo para la minería con operador (2131, Servicios relacionados con la minería); de maquinaria y equipo para la construcción con operador (2389, Otros trabajos especializados para la construcción); de aeronaves, barcos y carros ferroviarios con operador (481, Transporte aéreo; 482, Transporte por ferrocarril; 483, Transporte por agua); al arrendamiento financiero de maquinaria y equipo agropecuario, pesquero, industrial, comercial y de servicios, y maquinaria y equipo para mover, levantar y acomodar materiales (5224, Otras instituciones de intermediación crediticia y financiera no bursátil); al alquiler de camiones de carga, autobuses, minibuses y remolques sin chofer (5321, Alquiler de automóviles, camiones y otros transportes terrestres); de aparatos eléctricos y electrónicos para el hogar y personales; de yates, canoas y botes; de muebles para ocasiones especiales; de muebles para casas; de equipo médico de uso doméstico (5322, Alquiler de artículos para el hogar y personales); a proporcionar acceso a computadoras para usar internet (5614, Servicios de apoyo secretarial, fotocopiado, cobranza, investigación crediticia y similares), y al alquiler de sanitarios portátiles (5629, Servicios de remediación, recuperación, y otros servicios de manejo de residuos).
5331,533,Servicios de alquiler de marcas registradas, patentes y franquicias,Véase la descripción de la categoría 533110.,,
5411,541,Servicios legales,Unidades económicas dedicadas principalmente a proporcionar servicios de asesoría y representación jurídica, para la defensa legal ante un tribunal o agencia administrativa; servicios notariales y de certificación con la finalidad de dar fe y legalidad a actos y hechos jurídicos, y servicios de asesoría y apoyo para efectuar trámites legales.,Incluye también: unidades económicas que sin ser notarías se dedican principalmente a apoyar en el registro de títulos de propiedad, verificar que toda la documentación necesaria para efectuar una compra-venta de bienes inmuebles esté en regla y preparar el papeleo correspondiente; u.e.d.p. a la correduría pública, y a investigar si el inmueble que va a ser vendido cumple con todos los requisitos legales.,Excluye: u.e.d.p. a proporcionar servicios de pagos en nombre de los clientes, que no implican ningún trámite legal (5614, Servicios de apoyo secretarial, fotocopiado, cobranza, investigación crediticia y similares), y agencias aduanales (4885, Servicios de intermediación para el transporte de carga).
5412,541,Servicios de contabilidad, auditoría y servicios relacionados,Véase la descripción de la categoría 54121.,,
5413,541,Servicios de arquitectura, ingeniería y actividades relacionadas,Unidades económicas dedicadas principalmente a proporcionar servicios de arquitectura, arquitectura de paisaje y urbanismo, ingeniería, y actividades relacionadas, como servicios de dibujo, inspección de edificios, levantamiento geofísico, elaboración de mapas y laboratorios de pruebas.,Incluye también: u.e.d.p. a los servicios de fotogrametría, topografía, agrimensura y levantamiento catastral.,Excluye: u.e.d.p. a la explotación de minerales; a la exploración o prospección minera (21, Minería); a la supervisión de la construcción de las obras; a la construcción de edificaciones y obras de ingeniería civil; a la construcción de obras de urbanización; a los servicios de arquitectura o ingeniería en combinación con actividades de construcción (23, Construcción); a la edición de libros, atlas y mapas (5111, Edición de periódicos, revistas, libros y similares, y edición de estas publicaciones integrada con la impresión), y de libros, atlas y mapas exclusivamente a través de internet (5191, Otros servicios de información); a la valuación de bienes inmuebles (5313, Servicios relacionados con los servicios inmobiliarios); a la planeación, diseño y decoración de espacios interiores de edificaciones residenciales y no residenciales; al diseño industrial; al diseño gráfico (5414, Diseño especializado); a la asesoría en la instalación de equipo y redes informáticas (5415, Servicios de diseño de sistemas de cómputo y servicios relacionados); a la certificación de sistemas administrativos; a la consultoría en medio ambiente (5416, Servicios de consultoría administrativa, científica y técnica); a la investigación científica y desarrollo en ciencias naturales y exactas, ingeniería, y ciencias de la vida (5417, Servicios de investigación científica y desarrollo); al control y exterminación de plagas en inmuebles; a la instalación y mantenimiento de áreas verdes (5617, Servicios de limpieza); a proporcionar servicios de análisis médicos y de diagnóstico para las personas (6215, Laboratorios médicos y de diagnóstico); a la verificación vehicular, y a la reparación mecánica en general de automóviles y camiones en combinación con los servicios de verificación vehicular (8111, Reparación y mantenimiento de automóviles y camiones); a la generación de información catastral (9312, Administración pública en general); laboratorios de análisis clínicos veterinarios (5419, Otros servicios profesionales, científicos y técnicos), y caricaturistas independientes (7115, Artistas, escritores y técnicos independientes).
5414,541,Diseño especializado,Unidades económicas dedicadas principalmente al diseño especializado, como diseño y decoración de interiores, diseño industrial, gráfico, de modas y otros diseños especializados.,Incluye también: artistas dedicados exclusivamente a generar dibujos e ilustraciones, requiriendo exactitud técnica y habilidad de interpretación.,Excluye: u.e.d.p. a la instalación de muros y plafones falsos (2383, Trabajos de acabados en edificaciones); a las actividades de maquila y ensamble en serie de partes y componentes fabricados; al diseño y confección de modelos de prendas de vestir para su reproducción masiva (31-33, Industrias manufactureras); al comercio de muebles, cuadros, cortinas y otros objetos para decorar interiores (46, Comercio al por menor); a la edición de historietas (5111, Edición de periódicos, revistas, libros y similares, y edición de estas publicaciones integrada con la impresión); a la planeación y diseño de edificaciones residenciales y no residenciales; al diseño en ingeniería; a la elaboración de planos, ilustraciones, modelos o dibujos que muestran la distribución o arreglo de especificaciones de ingeniería o arquitectura (5413, Servicios de arquitectura, ingeniería y actividades relacionadas); a la investigación científica y desarrollo en ingeniería (5417, Servicios de investigación científica y desarrollo); a la creación de campañas publicitarias y su difusión en medios masivos de comunicación; a la colocación de anuncios publicitarios y al diseño de anuncios (con la subcontratación de otra unidad económica para que los fabrique); a proporcionar servicios de campañas de publicidad por correo directo; a los servicios de rotulación (5418, Servicios de publicidad y actividades relacionadas); diseñadores de vestuario teatral, y caricaturistas independientes (7115, Artistas, escritores y técnicos independientes).
5415,541,Servicios de diseño de sistemas de cómputo y servicios relacionados,Véase la descripción de la categoría 541510.,,
5416,541,Servicios de consultoría administrativa, científica y técnica,Unidades económicas dedicadas principalmente a la consultoría en administración, medio ambiente, y otros servicios de consultoría científica y técnica.,Incluye también: u.e.d.p. a la consultoría en mercadotecnia; a la consultoría actuarial (en compensaciones y beneficios para empleados); a la consultoría en administración de servicios públicos y telecomunicaciones; a la consultoría en sanidad, y a la certificación de sistemas administrativos.,Excluye: u.e.d.p. a proporcionar servicios de asesoría en inversiones en el mercado de valores (5239, Asesoría en inversiones y otros servicios relacionados con la intermediación bursátil); a los servicios de ingeniería ambiental; a proporcionar pruebas de productos o sustancias, y certificación de productos (5413, Servicios de arquitectura, ingeniería y actividades relacionadas); a la asesoría en la instalación de equipo y redes informáticas (5415, Servicios de diseño de sistemas de cómputo y servicios relacionados); a la investigación científica y desarrollo en ciencias naturales y exactas, ingeniería, y ciencias de la vida, y a la investigación científica y desarrollo en ciencias sociales y humanidades (5417, Servicios de investigación científica y desarrollo); a la consultoría en publicidad; a la consultoría política, y en relaciones públicas (5418, Servicios de publicidad y actividades relacionadas); a la investigación de mercados y encuestas de opinión pública (5419, Otros servicios profesionales, científicos y técnicos); a proporcionar una variedad de servicios administrativos para la administración diaria de negocios (5611, Servicios de administración de negocios); a la consultoría en búsqueda de ejecutivos (5613, Servicios de empleo); a proporcionar servicios de manejo de residuos peligrosos o no peligrosos (562, Manejo de residuos y servicios de remediación); a proporcionar capacitación a ejecutivos (6114, Escuelas comerciales, de computación y de capacitación para ejecutivos), y a la consultoría en educación (6117, Servicios de apoyo a la educación).
5417,541,Servicios de investigación científica y desarrollo,Unidades económicas dedicadas principalmente a la investigación científica y desarrollo en ciencias naturales y exactas, ingeniería, arquitectura, ciencias biológicas, ciencias médicas y de la salud, ciencias agrícolas, veterinarias y ambientales, y en ciencias sociales y humanidades.,,Excluye: u.e.d.p. a proporcionar pruebas de productos o sustancias (5413, Servicios de arquitectura, ingeniería y actividades relacionadas); al diseño industrial (5414, Diseño especializado); a la consultoría en administración; en economía, y a la consultoría científica y técnica (5416, Servicios de consultoría administrativa, científica y técnica); a la investigación de mercados; laboratorios de análisis clínicos veterinarios (5419, Otros servicios profesionales, científicos y técnicos), y u.e.d.p. a proporcionar servicios de análisis médicos y de diagnóstico para las personas (6215, Laboratorios médicos y de diagnóstico).
5418,541,Servicios de publicidad y actividades relacionadas,Unidades económicas dedicadas principalmente a la publicidad y actividades relacionadas con ésta, como creación de campañas publicitarias y su difusión en medios masivos de comunicación; diseño e implementación de campañas de relaciones públicas; compra de tiempo o espacio publicitario en los medios en nombre del publicista o agencia de publicidad; representación de medios; renta de espacios publicitarios para colocar anuncios publicitarios; servicios de campañas de publicidad por correo directo; distribución de material publicitario, y otros servicios de publicidad.,Incluye también: u.e.d.p. a la consultoría en publicidad; a los servicios de cabildeo, consultoría política, y en relaciones públicas; a la publicidad aérea; a la colocación de anuncios publicitarios y al diseño de anuncios (con la subcontratación de otra unidad económica para que los fabrique); al diseño y ejecución de campañas publicitarias por correo directo combinados con la compilación, mantenimiento, renta y venta de listas de clientes potenciales, y agencias de promoción de ventas, es decir, las agencias que planean la publicidad, organizan y desarrollan campañas de promoción que estimulan en el consumidor la selección de bienes o servicios.,Excluye: u.e.d.p. al montaje o instalación de estructuras prefabricadas para tableros publicitarios (2381, Cimentaciones, montaje de estructuras prefabricadas y trabajos en exteriores); a la fabricación de anuncios publicitarios de todo tipo; al diseño integrado con la fabricación de anuncios (3399, Otras industrias manufactureras); a la edición, venta y licenciamiento de listas de correo, sin el diseño y ejecución de campañas publicitarias por correo directo (5111, Edición de periódicos, revistas, libros y similares, y edición de estas publicaciones integrada con la impresión); al diseño gráfico (5414, Diseño especializado); a la consultoría en mercadotecnia (5416, Servicios de consultoría administrativa, científica y técnica), y a la organización y promoción de congresos, convenciones y ferias comerciales e industriales (5619, Otros servicios de apoyo a los negocios).
5419,541,Otros servicios profesionales, científicos y técnicos,Unidades económicas dedicadas principalmente a proporcionar servicios de investigación de mercados y encuestas de opinión pública, fotografía y videograbación, traducción e interpretación, servicios veterinarios, y otros servicios profesionales, científicos y técnicos no clasificados en otra parte.,Incluye también: laboratorios de análisis clínicos veterinarios.,Excluye: u.e.d.p. a la inseminación artificial, y bancos de esperma animal (1152, Servicios relacionados con la cría y explotación de animales); u.e.d.p. a la producción de videoclips, comerciales y otros materiales audiovisuales, no realizada por las estaciones de televisión; a la postproducción de películas cinematográficas y de video; a la transcripción de diálogos insertados en películas —subtitulaje—; laboratorios fílmicos (5121, Industria fílmica y del video); u.e.d.p. a la valuación de bienes inmuebles (5313, Servicios relacionados con los servicios inmobiliarios); a proporcionar pruebas de productos o sustancias (5413, Servicios de arquitectura, ingeniería y actividades relacionadas); a la consultoría en mercadotecnia, y para la cría de ganado (5416, Servicios de consultoría administrativa, científica y técnica); a la investigación científica y desarrollo en ciencias agrícolas, veterinarias y ambientales, y en ciencias sociales y humanidades (5417, Servicios de investigación científica y desarrollo); a la transcripción simultánea de diálogos para la televisión y en reuniones y conferencias (5614, Servicios de apoyo secretarial, fotocopiado, cobranza, investigación crediticia y similares); a la enseñanza no formal de idiomas (6116, Otros servicios educativos); a proporcionar servicios de análisis médicos y de diagnóstico para las personas (6215, Laboratorios médicos y de diagnóstico); a proporcionar servicios de revelado e impresión de fotografías; servicios de alojamiento, aseo y corte de pelo y uñas, para mascotas; servicios de máquinas fotográficas que funcionan con monedas (8129, Servicios de revelado e impresión de fotografías y otros servicios personales), y fotógrafos artísticos independientes (7115, Artistas, escritores y técnicos independientes).
5511,551,Corporativos,Véase la descripción de la categoría 55111.,,
5611,561,Servicios de administración de negocios,Véase la descripción de la categoría 561110.,,
5612,561,Servicios combinados de apoyo en instalaciones,Véase la descripción de la categoría 561210.,,
5613,561,Servicios de empleo,Unidades económicas dedicadas principalmente a proveer personal laboral a otras unidades económicas.,Incluye también: u.e.d.p. a la consultoría en búsqueda de ejecutivos, y agencias de modelos.,Excluye: u.e.d.p. a la colocación de personal agrícola (1151, Servicios relacionados con la agricultura); a la consultoría de recursos humanos (5416, Servicios de consultoría administrativa, científica y técnica); a proporcionar una variedad de servicios administrativos para la administración diaria de negocios (5611, Servicios de administración de negocios); a la operación de servicios diversos en forma integral y coordinada para el funcionamiento de las instalaciones del cliente (5612, Servicios combinados de apoyo en instalaciones); a los servicios de protección y seguridad (5616, Servicios de investigación, protección y seguridad); a la limpieza de inmuebles; a la instalación y mantenimiento de áreas verdes (5617, Servicios de limpieza); a los servicios de enfermería a domicilio (6216, Servicios de enfermería a domicilio), y a la representación y administración de artistas y creativos, figuras deportivas, entrenadores y otras figuras públicas (7114, Agentes y representantes de artistas, deportistas y similares).
5614,561,Servicios de apoyo secretarial, fotocopiado, cobranza, investigación crediticia y similares,Unidades económicas dedicadas principalmente a proporcionar servicios de preparación de documentos; de casetas telefónicas sin operar las redes telefónicas alámbricas; recepción de llamadas telefónicas y promoción por teléfono de bienes o servicios; servicios de fotocopiado, fax, acceso a computadoras y afines; servicios de cobro de deudas en nombre del cliente; investigación de solvencia financiera, y otros servicios de apoyo secretarial.,Incluye también: u.e.d.p. a la corrección de estilo; a los servicios de estenografía no realizados en los tribunales, y a los servicios de correo de voz.,Excluye: u.e.d.p. a los servicios de impresión rápida combinados con servicios de fotocopiado, engargolado y enmicado (3231, Impresión e industrias conexas); al telemercadeo con ventas vía telefónica (4691, Comercio al por menor exclusivamente a través de internet, y catálogos impresos, televisión y similares); a proporcionar servicios de correo postal (4911, Servicios postales); a la recolección y entrega a domicilio de documentos y paquetes (492, Servicios de mensajería y paquetería); a la transcripción de diálogos insertados en películas ─subtitulaje─ (5121, Industria fílmica y del video); a proporcionar servicios de telefonía alámbrica por los operadores de telefonía; servicios de acceso a internet alámbrico o inalámbrico; servicio de radiolocalización móvil de personas (5173, Operadores de servicios de telecomunicaciones alámbricas e inalámbricas); al procesamiento electrónico de información (5182, Procesamiento electrónico de información, hospedaje y otros servicios relacionados); a los servicios de correo electrónico; servicios de información por teléfono mediante mensajes pregrabados; portales de búsqueda en la web (5191, Otros servicios de información); u.e.d.p. al alquiler de equipo de cómputo (5324, Alquiler de maquinaria y equipo agropecuario, pesquero, industrial, comercial y de servicios); a proporcionar servicios de apoyo para efectuar trámites legales (5411, Servicios legales); servicios técnicos de contabilidad, como declaraciones de impuestos y pago de derechos, solicitudes de devolución de impuestos, y llenado de formatos fiscales (5412, Servicios de contabilidad, auditoría y servicios relacionados), y servicios de traducción de textos, interpretación de un idioma a otro y por señas (5419, Otros servicios profesionales, científicos y técnicos).
5615,561,Agencias de viajes y servicios de reservaciones,Unidades económicas dedicadas principalmente a los servicios de asesoría, planeación y organización de itinerarios de viajes; a la organización de excursiones y paquetes turísticos para ser vendidos por agencias de viajes, y a hacer reservaciones en hoteles, restaurantes, líneas de transporte y espectáculos.,Incluye también: u.e.d.p. a la promoción de ciudades que cuentan con la infraestructura necesaria para realizar congresos, convenciones, ferias y seminarios; al diseño, implementación y coordinación integral de un conjunto de servicios dentro de un destino turístico, y a los servicios de intercambio de tiempos compartidos.,Excluye: u.e.d.p. al transporte turístico por tierra, agua y aire (487, Transporte turístico); a la intermediación de operaciones inmobiliarias relacionadas con bienes raíces ubicados en desarrollos turísticos (5312, Inmobiliarias y corredores de bienes raíces); a proporcionar servicios de administración de bienes raíces propiedad de terceros; a la administración de bienes raíces en desarrollos turísticos, y a proporcionar servicios de consultoría o promoción de bienes raíces ubicados en desarrollos turísticos (5313, Servicios relacionados con los servicios inmobiliarios); a la organización y promoción de congresos, convenciones y ferias comerciales e industriales (5619, Otros servicios de apoyo a los negocios); a proporcionar alojamiento temporal mediante la modalidad de tiempos compartidos (7211, Hoteles, moteles y similares); guías de turismo que trabajan por cuenta propia (7139, Otros servicios recreativos), y unidades económicas gubernamentales dedicadas principalmente a regular, supervisar y apoyar las actividades de servicios, como la promoción de lugares turísticos (9313, Regulación y fomento del desarrollo económico).
5616,561,Servicios de investigación, protección y seguridad,Unidades económicas dedicadas principalmente a proporcionar servicios de investigación, protección y custodia de personas y bienes, excepto mediante monitoreo, y servicios de protección y custodia mediante el monitoreo de sistemas de seguridad.,Incluye también: u.e.d.p. a los servicios de detección de mentiras; a los servicios de cerrajería de alta seguridad, y a los servicios de monitoreo en combinación con la comercialización, instalación y reparación de sistemas de seguridad.,Excluye: u.e.d.p. a proveer personal propio a otras unidades económicas para apoyar o complementar la fuerza de trabajo de éstas por un tiempo determinado (5613, Servicios de empleo), y cerrajerías (8114, Reparación y mantenimiento de artículos para el hogar y personales).
