Código,código subsector,Título,Descripción,Incluye,Excluye
1111,111,Cultivo de semillas oleaginosas, leguminosas y cereales,Unidades económicas dedicadas principalmente a la siembra y cultivo de semillas oleaginosas, como soya, cártamo, girasol, canola, ajonjolí, linaza; de leguminosas para grano, como frijol, garbanzo, lenteja, y de cereales, como trigo, maíz, arroz, sorgo.,Incluye también: u.e.d.p. al cultivo de semillas oleaginosas o de leguminosas con la finalidad de cosechar la planta completa para aprovechamiento del ganado; al cultivo de sorgo escobero; unidades económicas que combinan el cultivo de diferentes semillas oleaginosas cuando sea imposible determinar cuál es la actividad principal; unidades económicas que combinan el cultivo de diferentes leguminosas para grano cuando sea imposible determinar cuál es la actividad principal, y unidades económicas que combinan el cultivo de diferentes cereales cuando sea imposible determinar cuál es la actividad principal.,Excluye: u.e.d.p. al cultivo de elote o maíz tierno; ejote, chícharo, haba cuya cosecha se realiza en verde (1112, Cultivo de hortalizas); a la producción de semillas mejoradas; al cultivo de algodón; de cacahuate; unidades económicas que combinan el cultivo de diferentes especies vegetales cuando sea imposible determinar cuál es la actividad principal; unidades económicas que combinan actividades agrícolas con explotación de animales cuando sea imposible determinar cuál es la actividad principal, y unidades económicas que combinan actividades agrícolas, explotación de animales y aprovechamiento forestal cuando sea imposible determinar cuál es la actividad principal (1119, Otros cultivos).
1112,111,Cultivo de hortalizas,Véase la descripción de la categoría 11121.,,
1113,111,Cultivo de frutales y nueces,Unidades económicas dedicadas principalmente al cultivo de frutales, como cítricos, café, plátano, manzana, cacao, coco, durazno, zapote, olivo, y nueces, como nuez pecanera.,Incluye también: u.e.d.p. al cultivo de coquito de aceite; de fresa; de nueces de palma, y unidades económicas que combinan el cultivo de diferentes especies de frutales y nueces cuando sea imposible determinar cuál es la actividad principal.,Excluye: u.e.d.p. al cultivo de melón y sandía (1112, Cultivo de hortalizas); a la producción de materiales de propagación de frutales y nueces, como sarmientos, patrones, frutales jóvenes e hijuelos de frutales (1114, Cultivo en invernaderos y otras estructuras agrícolas protegidas, y floricultura); a la recolección de frutas silvestres (1132, Viveros forestales y recolección de productos forestales); unidades económicas que combinan actividades agrícolas con explotación de animales cuando sea imposible determinar cuál es la actividad principal; unidades económicas que combinan actividades agrícolas, explotación de animales y aprovechamiento forestal cuando sea imposible determinar cuál es la actividad principal, y unidades económicas que combinan el cultivo de diferentes especies vegetales cuando sea imposible determinar cuál es la actividad principal (1119, Otros cultivos).
1114,111,Cultivo en invernaderos y otras estructuras agrícolas protegidas, y floricultura,Unidades económicas dedicadas principalmente al cultivo de todo tipo de plantas, anuales y perennes, en invernaderos y otras estructuras agrícolas protegidas, y al cultivo de flores para corte tanto en invernaderos y otras estructuras agrícolas protegidas como a cielo abierto; al cultivo de árboles de Navidad y de especies maderables de ciclos productivos de 10 años o menos, y a la producción de materiales de propagación, como sarmientos, bulbos, patrones, estacas, esquejes, hijuelos y plantas jóvenes.,Incluye también: u.e.d.p. a la producción de plántulas y plantitas de hortalizas en almácigos; a los cultivos hidropónicos, y unidades económicas que combinan diferentes cultivos en invernaderos y otras estructuras agrícolas protegidas cuando sea imposible determinar cuál es la actividad principal.,Excluye: u.e.d.p. al cultivo de hortalizas a cielo abierto (1112, Cultivo de hortalizas); al cultivo de fresas y bayas (berries) a cielo abierto (1113, Cultivo de frutales y nueces); a la acuicultura vegetal (1125, Acuicultura); a la plantación, reforestación y conservación de especies maderables de ciclos productivos mayores de 10 años (1131, Silvicultura); unidades económicas que combinan el cultivo de diferentes especies vegetales cuando sea imposible determinar cuál es la actividad principal (1119, Otros cultivos), y viveros dedicados principalmente al cultivo de especies forestales para tareas de forestación y reforestación (1132, Viveros forestales y recolección de productos forestales).
1119,111,Otros cultivos,Unidades económicas dedicadas principalmente al cultivo de tabaco, algodón, caña de azúcar, alfalfa, pastos forrajeros, agaves, cacahuate, especias, té, amaranto, césped o pasto en rollo o en panes y otros cultivos no clasificados en otra parte; a la combinación de actividades agrícolas con explotación de animales cuando sea imposible determinar cuál es la actividad principal; a la combinación de actividades agrícolas con aprovechamiento forestal cuando sea imposible determinar cuál es la actividad principal, y a la combinación de actividades agrícolas, explotación de animales y aprovechamiento forestal cuando sea imposible determinar cuál es la actividad principal.,Incluye también: u.e.d.p. al cultivo de trébol; al cultivo de plantas para la obtención de fibras textiles; a la recolección de savia de maple; a la recolección de gomas, resinas y otros productos forestales en plantaciones o que realizan para ello alguna labor agrícola; a la producción de semillas mejoradas, y unidades económicas que combinan el cultivo de diferentes especies vegetales cuando sea imposible determinar cuál es la actividad principal.,Excluye: u.e.d.p. al cultivo de soya y semillas oleaginosas (1111, Cultivo de semillas oleaginosas, leguminosas y cereales); al cultivo de cacao; de coco; de olivo; de nueces de palma (1113, Cultivo de frutales y nueces); a la acuicultura vegetal (1125, Acuicultura); a la explotación de animales combinada con aprovechamiento forestal cuando sea imposible determinar cuál es la actividad principal (1129, Explotación de otros animales); a la recolección de gomas, resinas y otros productos forestales cuando no se realiza para ello ninguna labor agrícola previa (1132, Viveros forestales y recolección de productos forestales); a la elaboración de pulque (3121, Industria de las bebidas), y a los servicios de instalación y mantenimiento de áreas verdes en interiores y exteriores de inmuebles (5617, Servicios de limpieza).
1121,112,Explotación de bovinos,Unidades económicas dedicadas principalmente a la explotación de ganado bovino para la producción de carne; de leche; producción conjunta de leche y carne, y para otros propósitos distintos a los anteriores.,Incluye también: u.e.d.p. a la cría de becerras y sementales en desarrollo para ser utilizados como ganado bovino para la producción de leche, y unidades económicas que combinan la explotación de ganado bovino con diferentes propósitos cuando sea imposible determinar cuál es la actividad principal.,Excluye: unidades económicas que combinan actividades agrícolas con explotación de animales cuando sea imposible determinar cuál es la actividad principal (1119, Otros cultivos); unidades económicas que combinan la explotación de animales de diferentes especies cuando sea imposible determinar cuál es la actividad principal, y unidades económicas dedicadas a la explotación de bovinos combinada con aprovechamiento forestal cuando sea imposible determinar cuál es la actividad principal (1129, Explotación de otros animales).
1122,112,Explotación de porcinos,Véase la descripción de la categoría 11221.,,
1123,112,Explotación avícola,Unidades económicas dedicadas principalmente a la explotación de aves para la producción de carne o de huevo y a la producción de aves en incubadora.,Incluye también: unidades económicas que combinan la explotación de diferentes tipos de aves en cualquiera de sus fases para la producción de carne y huevo cuando sea imposible determinar cuál es la actividad principal.,Excluye: u.e.d.p. a la explotación de aves de ornato en ambientes controlados; unidades económicas que combinan la explotación de animales de diferentes especies cuando sea imposible determinar cuál es la actividad principal (1129, Explotación de otros animales), y unidades económicas que combinan actividades agrícolas con explotación de animales cuando sea imposible determinar cuál es la actividad principal (1119, Otros cultivos).
1124,112,Explotación de ovinos y caprinos,Unidades económicas dedicadas principalmente a la explotación de ovinos y caprinos.,Incluye también: unidades económicas que combinan la explotación de ovinos con la de caprinos cuando sea imposible determinar cuál es la actividad principal.,Excluye: unidades económicas que combinan actividades agrícolas con explotación de animales cuando sea imposible determinar cuál es la actividad principal (1119, Otros cultivos); unidades económicas que combinan la explotación de ovinos y caprinos con aprovechamiento forestal cuando sea imposible determinar cuál es la actividad principal, y unidades económicas que combinan la explotación de animales de diferentes especies cuando sea imposible determinar cuál es la actividad principal (1129, Explotación de otros animales).
1125,112,Acuicultura,Véase la descripción de la categoría 11251.,,
1129,112,Explotación de otros animales,Unidades económicas dedicadas principalmente a la explotación de abejas, équidos, conejos, chinchillas, zorros, perros, gatos, gallos de pelea, aves de ornato, gusanos de seda, llamas, venados y otros animales no clasificados en otra parte, y unidades económicas dedicadas a la explotación de animales combinada con aprovechamiento forestal cuando sea imposible determinar cuál es la actividad principal.,Incluye también: unidades económicas que combinan la explotación de animales de diferentes especies cuando sea imposible determinar cuál es la actividad principal.,Excluye: u.e.d.p. a la producción de aves en incubadora (1123, Explotación avícola); a la explotación de cocodrilos en ambientes controlados (1125, Acuicultura); a la caza y captura de animales; al aprovechamiento sustentable de las especies silvestres en reservas para caza y captura, como los ranchos cinegéticos (1142, Caza y captura); a proporcionar el servicio de pensión para equinos (1152, Servicios relacionados con la cría y explotación de animales); a la pasteurización, homogeneización y envasado de miel (3119, Otras industrias alimentarias); al comercio al por menor especializado de aves de ornato, perros, gatos (4659, Comercio al por menor de mascotas, regalos, artículos religiosos, desechables, artesanías y otros artículos de uso personal); a la exhibición de animales salvajes (7121, Museos, sitios históricos, zoológicos y similares), y unidades económicas que combinan actividades agrícolas con explotación de animales cuando sea imposible determinar cuál es la actividad principal (1119, Otros cultivos).
1131,113,Silvicultura,Véase la descripción de la categoría 113110.,,
1132,113,Viveros forestales y recolección de productos forestales,Véase la descripción de la categoría 11321.,,
1133,113,Tala de árboles,Véase la descripción de la categoría 113310.,,
1141,114,Pesca,Véase la descripción de la categoría 11411.,,
1142,114,Caza y captura,Véase la descripción de la categoría 114210.,,
1151,115,Servicios relacionados con la agricultura,Véase la descripción de la categoría 11511.,,
1152,115,Servicios relacionados con la cría y explotación de animales,Véase la descripción de la categoría 115210.,,
1153,115,Servicios relacionados con el aprovechamiento forestal,Véase la descripción de la categoría 115310.,,
2111,211,Extracción de petróleo y gas,Véase la descripción de la categoría 21111.,,
2121,212,Minería de carbón mineral,Véase la descripción de la categoría 212110.,,
2122,212,Minería de minerales metálicos,Unidades económicas dedicadas principalmente a la explotación de minerales metálicos, como hierro, oro, plata, cobre, plomo, zinc y otros minerales metálicos, y a actividades de beneficio, como la trituración, el cribado, la molienda, la concentración magnética, la flotación y la lixiviación, encaminadas a la obtención de concentrados y precipitados.,Incluye también: u.e.d.p. a la explotación de cobre por medio de la extracción por solventes y deposición electrolítica.,Excluye: u.e.d.p. a la explotación de pirita y pirrotina (2123, Minería de minerales no metálicos); al enriquecimiento de minerales radiactivos (3251, Fabricación de productos químicos básicos); a la producción de hierro de primera fusión o arrabio; de ferroaleaciones (3311, Industria básica del hierro y del acero), y a la fundición, afinación, refinación y recuperación de metales (3311, Industria básica del hierro y del acero; 3314, Industrias de metales no ferrosos, excepto aluminio, y 3315, Moldeo por fundición de piezas metálicas).
2123,212,Minería de minerales no metálicos,Unidades económicas dedicadas principalmente a la explotación de minerales no metálicos, como piedras calizas, piedras dimensionadas (mármol, piedra de cantera); arena, grava, arcillas refractarias y no refractarias, y sal, y a actividades de beneficio, como el cribado, la trituración y otros tratamientos a tierras y rocas.,Incluye también: u.e.d.p. a la explotación de granito, ónix y serpentina; a la explotación y beneficio de mica; a la explotación de confitillo y cacahuatillo, y a la recolección de sal mediante la evaporación al sol de agua de mar, salmuera de lago y otras salmueras naturales.,Excluye: u.e.d.p. a la minería de carbón mineral (2121, Minería de carbón mineral); a la elaboración de sal refinada y yodatada (3119, Otras industrias alimentarias); a la fabricación de fertilizantes químicos (3253, Fabricación de fertilizantes, pesticidas y otros agroquímicos); a la obtención de arcilla integrada con la producción de artículos terminados (3271, Fabricación de productos a base de arcillas y minerales refractarios); a la fabricación de cemento (3273, Fabricación de cemento y productos de concreto); de cal y yeso (3274, Fabricación de cal, yeso y productos de yeso); de productos a base de piedras de cantera por medio del corte, dimensionado, pulido, laminado y biselado (3279, Fabricación de otros productos a base de minerales no metálicos), y de electrodos de grafito (3359, Fabricación de otros equipos y accesorios eléctricos).
2131,213,Servicios relacionados con la minería,Véase la descripción de la categoría 21311.,,
2211,221,Generación, transmisión, distribución y comercialización de energía eléctrica,Unidades económicas dedicadas principalmente a la generación, transmisión, distribución y comercialización de energía eléctrica.,Incluye también: u.e.d.p. a prestar el servicio de suministro eléctrico a los usuarios finales.,
2212,221,Suministro de gas natural por ductos al consumidor final,Véase la descripción de la categoría 221210.,,
2213,221,Captación, tratamiento y suministro de agua,Véase la descripción de la categoría 22131.,,
2361,236,Edificación residencial,Véase la descripción de la categoría 23611.,,
2362,236,Edificación no residencial,Unidades económicas dedicadas principalmente a la construcción de edificios no residenciales para fines industriales, comerciales y de servicios, y a la supervisión de la construcción de los inmuebles no residenciales. Puede tratarse de trabajos nuevos, ampliaciones, remodelaciones, mantenimiento o reparaciones de edificios no residenciales.,Incluye también: u.e.d.p. a la construcción operativa de edificaciones no residenciales (construcción de edificaciones por cuenta propia y en terrenos propios para luego ser vendidas), y a la edificación de estructuras cuya construcción es similar a la de las naves y plantas industriales, como incineradores, plantas de cemento, altos hornos, plantas de disposición de desechos.,Excluye: u.e.d.p. a la supervisión durante la edificación de inmuebles residenciales (2361, Edificación residencial); a la supervisión durante la construcción de obras de ingeniería civil (237, Construcción de obras de ingeniería civil); a la construcción de plantas de refinería y petroquímica (2371, Construcción de obras para el suministro de agua, petróleo, gas, energía eléctrica y telecomunicaciones); de instalaciones deportivas al aire libre (2379, Otras construcciones de ingeniería civil); a la realización de trabajos especializados para la construcción (238, Trabajos especializados para la construcción); a la construcción de albercas en exteriores (2389, Otros trabajos especializados para la construcción); a la intermediación en las operaciones de venta y alquiler de bienes raíces (5312, Inmobiliarias y corredores de bienes raíces), y a proporcionar servicios de ingeniería o arquitectura cuando no involucran la construcción (5413, Servicios de arquitectura, ingeniería y actividades relacionadas).
2371,237,Construcción de obras para el suministro de agua, petróleo, gas, energía eléctrica y telecomunicaciones,Unidades económicas dedicadas principalmente a la construcción de obras para el suministro de agua, petróleo y gas; a la construcción de obras para la generación y conducción de energía eléctrica y de obras para telecomunicaciones, y a la supervisión de la construcción de las obras para el suministro de agua, petróleo, gas, energía eléctrica y obras para telecomunicaciones. Puede tratarse de trabajos nuevos, ampliaciones, remodelaciones, mantenimiento o reparaciones de obras para el suministro de agua, petróleo, gas, energía eléctrica y telecomunicaciones.,Incluye también: u.e.d.p. a la realización de trabajos especializados que requieren habilidades y equipo específicos para obras de suministro de agua, petróleo, gas, energía eléctrica y obras para telecomunicaciones exclusivamente.,Excluye: u.e.d.p. a la perforación de pozos petroleros y de gas; a la supervisión de la perforación de pozos petroleros y de gas (2131, Servicios relacionados con la minería); a la construcción de plantas químicas; a la supervisión durante la construcción de plantas químicas; de inmuebles comerciales y de servicios (2362, Edificación no residencial); a la construcción de obras de urbanización; a la supervisión durante la construcción de obras de urbanización (2372, División de terrenos y construcción de obras de urbanización); a la construcción de presas, represas, obras marítimas, fluviales y subacuáticas, plantas hidroeléctricas; a la supervisión durante la construcción de presas, represas, obras marítimas, fluviales y subacuáticas, plantas hidroeléctricas (2379, Otras construcciones de ingeniería civil); a la instalación de redes eléctricas, de alumbrado y de sistemas electrónicos en construcciones (2382, Instalaciones y equipamiento en construcciones), y a proporcionar servicios de ingeniería o arquitectura cuando no involucran la construcción (5413, Servicios de arquitectura, ingeniería y actividades relacionadas).
2372,237,División de terrenos y construcción de obras de urbanización,Véase la descripción de la categoría 23721.,,
2373,237,Construcción de vías de comunicación,Véase la descripción de la categoría 23731.,,
2379,237,Otras construcciones de ingeniería civil,Véase descripción de la categoría 23799.,,
2381,238,Cimentaciones, montaje de estructuras prefabricadas y trabajos en exteriores,Unidades económicas dedicadas principalmente a realizar trabajos de cimentaciones, montaje de estructuras prefabricadas de concreto o acero, así como a realizar otros trabajos en exteriores, y de albañilería. Puede tratarse de trabajos nuevos, ampliaciones, remodelaciones, mantenimiento o reparaciones de las cimentaciones, los montajes de estructuras prefabricadas y los trabajos en exteriores.,Incluye también: u.e.d.p. a la realización de trabajos de herrería en el lugar de la construcción.,Excluye: u.e.d.p. a la edificación residencial y no residencial (236, Edificación); a realizar trabajos especializados que requieren habilidades y equipo específicos para las obras de ingeniería civil exclusivamente; a la construcción de obras de ingeniería civil (237, Construcción de obras de ingeniería civil); a trabajos de aplicaciones de yeso, pastas a base de grano de mármol o gravilla, y tirol rústico o planchado; al pintado de interiores y exteriores de edificaciones y al cubrimiento de paredes con materiales ornamentales; a la colocación de losetas cerámicas y de barro, mosaicos, terrazos, mármoles, granito, adoquín y azulejos; a la impermeabilización de construcciones (2383, Trabajos de acabados en edificaciones); a la fabricación de productos preesforzados de concreto integrada con la instalación en el lugar de la construcción (3273, Fabricación de cemento y productos de concreto), y a la fabricación de estructuras de acero combinada con la instalación en el lugar de la construcción (3323, Fabricación de estructuras metálicas y productos de herrería).
2382,238,Instalaciones y equipamiento en construcciones,Unidades económicas dedicadas principalmente a realizar instalaciones de redes eléctricas, de alumbrado, de sistemas electrónicos, de gas, hidrosanitarias, de sistemas centrales de aire acondicionado y calefacción, y otras instalaciones en construcciones. Puede tratarse de trabajos nuevos, ampliaciones, remodelaciones, mantenimiento o reparaciones de instalaciones en construcciones.,Incluye también: u.e.d.p. a la instalación de cableado para redes y computadoras, y al desarme de maquinaria y equipo de gran escala.,Excluye: u.e.d.p. a realizar trabajos especializados que requieren habilidades y equipo específicos para las obras de ingeniería civil exclusivamente (237, Construcción de obras de ingeniería civil); a la construcción de obras de generación y conducción de energía eléctrica (2371, Construcción de obras para el suministro de agua, petróleo, gas, energía eléctrica y telecomunicaciones); al comercio al por mayor especializado de aparatos de calefacción, ventilación y de aire acondicionado domésticos (4335, Comercio al por mayor de electrodomésticos menores y aparatos de línea blanca); de escaleras eléctricas (4354, Comercio al por mayor de mobiliario y equipo de cómputo y de oficina, y de otra maquinaria y equipo de uso general); al comercio al por menor especializado de aparatos de calefacción, ventilación y de aire acondicionado domésticos nuevos (4661, Comercio al por menor de muebles para el hogar y otros enseres domésticos); a la asesoría en la instalación de equipo y redes informáticas (5415, Servicios de diseño de sistemas de cómputo y servicios relacionados); al monitoreo en combinación con la comercialización, instalación y reparación de sistemas de seguridad (5616, Servicios de investigación, protección y seguridad); a la limpieza de ductos de ventilación (5617, Servicios de limpieza); a la reparación y mantenimiento de maquinaria y equipo industrial (8113, Reparación y mantenimiento de maquinaria y equipo agropecuario, industrial, comercial y de servicios), y a la reparación y mantenimiento de aparatos eléctricos para el hogar y personales, como ventiladores (8114, Reparación y mantenimiento de artículos para el hogar y personales).
2383,238,Trabajos de acabados en edificaciones,Unidades económicas dedicadas principalmente a la colocación de muros falsos y material para aislamiento; a los trabajos de enyesado, pintura y otros cubrimientos de paredes; a la colocación de pisos y azulejos; a la realización de trabajos de carpintería en el lugar de la construcción, y a otros trabajos de acabados en edificaciones. Puede tratarse de trabajos nuevos, ampliaciones, remodelaciones, mantenimiento o reparaciones de trabajos de acabados en edificaciones.,Incluye también: u.e.d.p. a la instalación de productos de carpintería, como puertas, ventanas, closets, escaleras, estantes y molduras.,Excluye: u.e.d.p. a realizar trabajos especializados que requieren habilidades y equipo específicos para las obras de ingeniería civil exclusivamente (237, Construcción de obras de ingeniería civil); a la aplicación de aplanados a base de mortero; a realizar trabajos de albañilería (2381, Cimentaciones, montaje de estructuras prefabricadas y trabajos en exteriores); a la fabricación de productos de madera para la construcción; de casas prefabricadas de madera (3219, Fabricación de otros productos de madera); de cocinas integrales y muebles modulares para baño (3371, Fabricación de muebles, excepto de oficina y estantería); al comercio al por menor de alfombras, losetas vinílicas, linóleos, pisos de madera, tapices y similares combinado con la instalación (4663, Comercio al por menor de artículos para la decoración de interiores); al comercio al por menor especializado de vidrios, espejos y vitrales combinado con el armado de canceles (4671, Comercio al por menor de artículos de ferretería, tlapalería y vidrios); a la reparación de muebles para el hogar (8114, Reparación y mantenimiento de artículos para el hogar y personales), y restauradores de muebles antiguos (7115, Artistas, escritores y técnicos independientes).
